{"$schema":"https://json-schema.org/draft/2020-12/schema","$id":"https://schemas.kujolang.ai/searchbridge/adapter-manifest.v2.json","type":"object","required":["contract","id","adapter_version","provider_api_version","minimum_searchbridge_version","capabilities","credentials","cost_class","operations","fixtures","publisher","signature"],"properties":{"contract":{"const":"searchbridge-adapter/v2"},"id":{"type":"string","pattern":"^[a-z][a-z0-9-]*$"},"adapter_version":{"type":"string"},"provider_api_version":{"type":"string"},"minimum_searchbridge_version":{"type":"string"},"maximum_searchbridge_version":{"type":"string"},"capabilities":{"type":"array","minItems":1,"items":{"type":"object","required":["id","contract","class"],"properties":{"id":{"type":"string"},"contract":{"type":"string"},"class":{"const":"read"}},"additionalProperties":false}},"credentials":{"type":"array","items":{"type":"object","required":["name","mode","bind"],"properties":{"name":{"type":"string","pattern":"^[A-Z][A-Z0-9_]*$"},"mode":{"enum":["none","bearer","header","basic","query","body"]},"bind":{"type":"object"},"field":{"type":"string"}},"additionalProperties":false}},"cost_class":{"enum":["free","quota","metered","expensive","unknown"]},"operations":{"type":"array","minItems":1,"items":{"type":"object","required":["id","capability","class","request","response","pagination","normalization","cost","fixture"],"properties":{"id":{"type":"string"},"capability":{"type":"string"},"class":{"const":"read"},"request":{"type":"object"},"response":{"type":"object"},"pagination":{"type":"object"},"reliability":{"type":"object"},"deprecation":{"type":"object"},"normalization":{"type":"object"},"cost":{"type":"object"},"fixture":{"type":"string"}},"additionalProperties":false}},"fixtures":{"type":"array"},"package_files":{"type":"array"},"publisher":{"type":"object"},"signature":{"type":"object"},"retention":{"type":"object"},"streaming":{"type":"string"}},"additionalProperties":false}
