{"adapter_version":"1.0.0","capabilities":[{"class":"read","contract":"analytics/v1","id":"analytics"}],"contract":"searchbridge-adapter/v2","cost_class":"quota","credentials":[{"bind":{"endpoint_template":"https://plausible.io/api/v2/query"},"mode":"bearer","name":"SEARCHBRIDGE_PLAUSIBLE_TOKEN"}],"fixtures":[{"license":"synthetic","operation":"stats-query","request_sha256":"44136fa355b3678a1146ad16f7e8649e94fb4fc21fe77e8310c060f61caaff8a","response_sha256":"2cf8062b6c97b567442c0d2927423a9697015a3219c0e09608ed342273bd1472"}],"id":"plausible","minimum_searchbridge_version":"0.4.0","operations":[{"capability":"analytics","class":"read","cost":{"estimate":"one-per-call","preflight":"none","unit_name":"request"},"fixture":"fixtures/analytics.json","id":"stats-query","normalization":{"row_contract":"analytics/v1","unknown_fields":"discard"},"pagination":{"request_slot":"body.pagination.offset","strategy":"offset-limit"},"request":{"allowed_query_fields":["site_id","metrics","dimensions","date_range","filters"],"credential":"SEARCHBRIDGE_PLAUSIBLE_TOKEN","endpoint_template":"https://plausible.io/api/v2/query","method":"POST","redirects":"deny"},"response":{"format":"json","max_bytes":8388608,"rows_pointer":"/results"}}],"package_files":[{"path":"fixtures/analytics.json","sha256":"2cf8062b6c97b567442c0d2927423a9697015a3219c0e09608ed342273bd1472"}],"provider_api_version":"stats-v2","publisher":{"key_fingerprint":"sha256:3fc7b248abb249f2946af4b2c1084b3fafebe47ef522962d0146c5920275aefd","name":"SearchBridge reference package"},"retention":{"max_cache_age_seconds":86400,"source":"operator-policy"},"signature":{"algorithm":"rsa-sha256","canonicalization":"jcs","detached_file":"adapter.sig"},"streaming":"page-jsonl"}
